{"apply":{"at":"2025-10-27T20:32:27Z","hold_ms":2000,"ramp_ms":10,"ttl_ms":10000},"band_count":6,"dac":{"quantization":"nearest","sample_rate_GSa":64,"width_bits":14},"hfp_hash":"979ce0f6f808fda84adbe2dd56f2c3e9e0dc37271d527d5d6801eb224cd1fd3088cbeeefd5460a63cc9736cb4f5b88a6709a38b5b79ea583a55f273dbbf04e5a","mode":"static","params":{"I_bias_mA":[30.17029848013184,32.26606848562534,15.0,27.431483855215774,50.0,28.681254959409145],"alpha":[2.674845876823537,2.0,2.1252517853872916,6.0,5.7021302569736925,3.1206738692547153],"delta_f_GHz":[-2.1821400231947754,-1.331258011353233,-0.13367515107123218,-10.0,-2.896294939876701,10.0],"kappa":[0.07661600439479949,0.9,0.8367026796069096,0.288143197216627,0.19340474882500153,0.05],"phi_rad":[1.3361788201314582,2.8869362998104338,3.141592653589793,2.4295903632413283,0.0,1.3779823480862023],"tau_ps":[159.65635109564795,156.32973203930902,279.73509125312825,300.0,243.34065799914546,50.0]},"session_id":"680cc58d-9364-457e-9731-bc5e977ea295","signing":{"alg":"HMAC-SHA256","key_id":"ctrl-01","nonce":"","sig":"538db74651c513072373db6fca0e37a529b94b6d6285fd347e53a9dd3944bed3","timestamp":"2025-10-27T20:32:27Z"},"version":"P-0.2"}